"DESCRIPTION","DURATION IN MS","NAME","PARENT SUITE","START TIME","STATUS","STOP TIME","SUB SUITE","SUITE","TEST CLASS","TEST METHOD"
"","5336","Ошибка смены валюты @BUG","firefox","Fri Dec 13 01:58:58 GMT 2024","passed","Fri Dec 13 01:59:03 GMT 2024","","academybugs.test.js","",""
"","5648","Ошибка подсчета общей стоимости товара в корзине @BUG","firefox","Fri Dec 13 01:59:03 GMT 2024","passed","Fri Dec 13 01:59:09 GMT 2024","","academybugs.test.js","",""
"","11956","Ошибка публикации комментария к товару @BUG","firefox","Fri Dec 13 01:59:09 GMT 2024","passed","Fri Dec 13 01:59:21 GMT 2024","","academybugs.test.js","",""
"","9563","Ошибка увеличения количества товаров в корзине @BUG","firefox","Fri Dec 13 01:58:39 GMT 2024","passed","Fri Dec 13 01:58:48 GMT 2024","","academybugs.test.js","",""
"","5142","Ошибка фильтрации товаров по ценовому диапазону @BUG","firefox","Fri Dec 13 01:59:25 GMT 2024","passed","Fri Dec 13 01:59:30 GMT 2024","","academybugs.test.js","",""
"","13023","Ошибка отображения количества товара на главной странице @BUG","firefox","Fri Dec 13 01:58:25 GMT 2024","passed","Fri Dec 13 01:58:38 GMT 2024","","academybugs.test.js","",""
"","9140","Ошибка возврата на главную страницу при удалении товара из козины @BUG","firefox","Fri Dec 13 01:58:48 GMT 2024","passed","Fri Dec 13 01:58:58 GMT 2024","","academybugs.test.js","",""
"","4442","Ошибка перехода на страницу производителя товара @BUG","firefox","Fri Dec 13 01:59:21 GMT 2024","passed","Fri Dec 13 01:59:25 GMT 2024","","academybugs.test.js","",""
