"DESCRIPTION","DURATION IN MS","NAME","PARENT SUITE","START TIME","STATUS","STOP TIME","SUB SUITE","SUITE","TEST CLASS","TEST METHOD"
"","8257","Ошибка возврата на главную страницу при удалении товара из козины @BUG","firefox","Tue Dec 10 01:59:27 GMT 2024","passed","Tue Dec 10 01:59:35 GMT 2024","","academybugs.test.js","",""
"","13066","Ошибка отображения количества товара на главной странице @BUG","firefox","Tue Dec 10 01:59:04 GMT 2024","passed","Tue Dec 10 01:59:17 GMT 2024","","academybugs.test.js","",""
"","5604","Ошибка смены валюты @BUG","firefox","Tue Dec 10 01:59:35 GMT 2024","passed","Tue Dec 10 01:59:41 GMT 2024","","academybugs.test.js","",""
"","5379","Ошибка подсчета общей стоимости товара в корзине @BUG","firefox","Tue Dec 10 01:59:41 GMT 2024","passed","Tue Dec 10 01:59:46 GMT 2024","","academybugs.test.js","",""
"","11620","Ошибка публикации комментария к товару @BUG","firefox","Tue Dec 10 01:59:46 GMT 2024","passed","Tue Dec 10 01:59:58 GMT 2024","","academybugs.test.js","",""
"","5109","Ошибка перехода на страницу производителя товара @BUG","firefox","Tue Dec 10 01:59:58 GMT 2024","passed","Tue Dec 10 02:00:03 GMT 2024","","academybugs.test.js","",""
"","9187","Ошибка увеличения количества товаров в корзине @BUG","firefox","Tue Dec 10 01:59:18 GMT 2024","passed","Tue Dec 10 01:59:27 GMT 2024","","academybugs.test.js","",""
"","4946","Ошибка фильтрации товаров по ценовому диапазону @BUG","firefox","Tue Dec 10 02:00:03 GMT 2024","passed","Tue Dec 10 02:00:08 GMT 2024","","academybugs.test.js","",""
