"DESCRIPTION","DURATION IN MS","NAME","PARENT SUITE","START TIME","STATUS","STOP TIME","SUB SUITE","SUITE","TEST CLASS","TEST METHOD"
"","9060","Ошибка увеличения количества товаров в корзине @BUG","firefox","Sat Dec 07 01:55:25 GMT 2024","passed","Sat Dec 07 01:55:34 GMT 2024","","academybugs.test.js","",""
"","7876","Ошибка фильтрации товаров по ценовому диапазону @BUG","firefox","Sat Dec 07 01:56:29 GMT 2024","passed","Sat Dec 07 01:56:37 GMT 2024","","academybugs.test.js","",""
"","9254","Ошибка возврата на главную страницу при удалении товара из козины @BUG","firefox","Sat Dec 07 01:55:34 GMT 2024","passed","Sat Dec 07 01:55:43 GMT 2024","","academybugs.test.js","",""
"","12741","Ошибка отображения количества товара на главной странице @BUG","firefox","Sat Dec 07 01:55:12 GMT 2024","passed","Sat Dec 07 01:55:24 GMT 2024","","academybugs.test.js","",""
"","12384","Ошибка публикации комментария к товару @BUG","firefox","Sat Dec 07 01:55:56 GMT 2024","passed","Sat Dec 07 01:56:09 GMT 2024","","academybugs.test.js","",""
"","6211","Ошибка подсчета общей стоимости товара в корзине @BUG","firefox","Sat Dec 07 01:55:50 GMT 2024","passed","Sat Dec 07 01:55:56 GMT 2024","","academybugs.test.js","",""
"","5759","Ошибка перехода на страницу производителя товара @BUG","firefox","Sat Dec 07 01:56:09 GMT 2024","passed","Sat Dec 07 01:56:14 GMT 2024","","academybugs.test.js","",""
"","6910","Ошибка смены валюты @BUG","firefox","Sat Dec 07 01:55:43 GMT 2024","passed","Sat Dec 07 01:55:50 GMT 2024","","academybugs.test.js","",""
