"DESCRIPTION","DURATION IN MS","NAME","PARENT SUITE","START TIME","STATUS","STOP TIME","SUB SUITE","SUITE","TEST CLASS","TEST METHOD"
"","11864","Ошибка отображения количества товара на главной странице @BUG","firefox","Mon Dec 16 02:02:00 GMT 2024","passed","Mon Dec 16 02:02:12 GMT 2024","","academybugs.test.js","",""
"","5235","Ошибка смены валюты @BUG","firefox","Mon Dec 16 02:02:31 GMT 2024","passed","Mon Dec 16 02:02:36 GMT 2024","","academybugs.test.js","",""
"","3562","Ошибка перехода на страницу производителя товара @BUG","firefox","Mon Dec 16 02:02:53 GMT 2024","passed","Mon Dec 16 02:02:57 GMT 2024","","academybugs.test.js","",""
"","11406","Ошибка публикации комментария к товару @BUG","firefox","Mon Dec 16 02:02:42 GMT 2024","passed","Mon Dec 16 02:02:53 GMT 2024","","academybugs.test.js","",""
"","8486","Ошибка увеличения количества товаров в корзине @BUG","firefox","Mon Dec 16 02:02:14 GMT 2024","passed","Mon Dec 16 02:02:23 GMT 2024","","academybugs.test.js","",""
"","3454","Ошибка фильтрации товаров по ценовому диапазону @BUG","firefox","Mon Dec 16 02:02:57 GMT 2024","passed","Mon Dec 16 02:03:00 GMT 2024","","academybugs.test.js","",""
"","8393","Ошибка возврата на главную страницу при удалении товара из козины @BUG","firefox","Mon Dec 16 02:02:23 GMT 2024","passed","Mon Dec 16 02:02:31 GMT 2024","","academybugs.test.js","",""
"","5396","Ошибка подсчета общей стоимости товара в корзине @BUG","firefox","Mon Dec 16 02:02:36 GMT 2024","passed","Mon Dec 16 02:02:42 GMT 2024","","academybugs.test.js","",""
